{
  "schema_version": "1.0.0",
  "package_id": "BD-AF-P0P3-V1",
  "package_fingerprint": "REQUIRED_64_HEX",
  "signature_namespace": "beidou-alpha-first-task-review-v1",
  "task_id": "REQUIRED_TASK_ID",
  "baseline_commit": "REQUIRED_TASK_START_40_HEX",
  "actual_head": "REQUIRED_40_HEX",
  "dependency_result_sha256": {},
  "approval_sha256": "REQUIRED_64_HEX",
  "approval_signature_sha256": "REQUIRED_64_HEX",
  "evidence_manifest_sha256": {},
  "changed_paths": [],
  "implementer_identity": "REQUIRED_IMPLEMENTER_IDENTITY",
  "implementer_status": "PASS",
  "decision": "ACCEPTED",
  "reviewer_identity": "REQUIRED_ALLOWED_SIGNERS_IDENTITY_DIFFERENT_FROM_IMPLEMENTER",
  "reviewed_at": "REQUIRED_RFC3339",
  "residual_risks": []
}
